category,subcategory,name,description,url,price,image
Wire and Cable,Cable Assembly USB,"Anker 3.3ft USB 3.0 Type-A to Micro-B Cable Assembly, 10Gbps, 5V/900mA","The Anker AKR-USB3-MB-1M is a 3.3ft USB 3.0 Type-A to Micro-B cable assembly with a data transfer rate of up to 10Gbps, operating voltage of 5V, and current rating of 900mA, suitable for applications such as data transfer and charging of smartphones, tablets, and other Micro-B devices, with a durable PVC jacket and standard USB connectors, in a 3.3ft long cable form-factor Key specs: USB 3.0, 10Gbps, 5V, 900mA.",https://www.arrow.com/en/products/cable_assembly_usb_akr_usb3_mb_1m,13.29,/images/Cable_Assembly_USB_AKR_USB3_MB_1M.jpg
Thermal Management,Heat Sinks,"Wakefield-Vette 6027 Extruded Aluminum Profile Heatsink, 12in L x 2.5in W x 0.5in H","The Wakefield-Vette 6027 is an extruded aluminum profile heatsink designed for high-power thermal management applications, featuring a length of 12 inches, a width of 2.5 inches, and a height of 0.5 inches. This heatsink is suitable for use with a wide range of power components, including transistors, diodes, and MOSFETs. Typical applications include industrial power conversion, medical devices, and LED lighting systems. The heatsink is easy to mount using standard screws and has a flat surface for efficient heat transfer. It is available in a compact form factor, making it ideal for use in space-constrained designs. Key specs: Extruded Aluminum, 12in L x 2.5in W x 0.5in H, 10-35°C Temperature Range.",https://www.arrow.com/en/products/heat_sinks_wv_6027_syn_14,20.49,/images/Heat_Sinks_WV_6027_SYN_14.jpg
Embedded Controllers and Systems,Single Board Computers - SBCs,Hardkernel ODROID-XU5 Edge AI Single Board Computer with Neural Processing Unit,"The ODROID-XU5 Edge AI Single Board Computer is a powerful ODROID-XU5-based single-board computer with a dedicated Neural Processing Unit, designed for AI and machine learning applications, featuring a 2GHz Samsung Exynos 5422 Octa-Core CPU and a Mali-T628 MP6 GPU, operating at a voltage range of 4.5V to 5.5V, and drawing a maximum current of 2.5A, typical applications include AI-powered robots, drones, and other IoT devices, and is provided in a compact 137mm x 90mm x 20mm form-factor. Key specs: 2GHz, Exynos 5422, Mali-T628 MP6, 4.5-5.5V, 2.5A, NPU.",https://www.arrow.com/en/products/single_board_computers_sbcs_odroid_xu5npu_syn,141.40,/images/Single_Board_Computers_SBCs_ODROID_XU5NPU_SYN.jpg
RF and Microwave,Combo Wireless Modules,u-blox C027-9434-M3 Wi-Fi 6 and Bluetooth 5.0 Combo Module,"The u-blox C027-9434-M3 is a Wi-Fi 6 and Bluetooth 5.0 combo module with a maximum data rate of 1.2Gbps and support for 2x2 MU-MIMO and Bluetooth mesh. Operating from 3.3V with a typical current consumption of 220mA in Wi-Fi transmit mode, this module features an industrial temperature range of -40°C to 85°C. Typical applications include industrial IoT, smart home devices, and medical equipment. The module is delivered in a compact 12x15mm LGA package. Key specs: 3.3V, 220mA, Wi-Fi 6, Bluetooth 5.0, 2x2 MU-MIMO, -40°C to 85°C, 12x15mm LGA.",https://www.arrow.com/en/products/combo_wireless_modules_c027_9434_syn,38.91,/images/Combo_Wireless_Modules_C027_9434_SYN.jpg
Computer Products,Keypads and Keyboards,"Corsair IP65 104-Key Industrial Membrane Keyboard, USB","The CKM104IP65-SYN is a 104-key IP65 industrial membrane keyboard designed for use in harsh environments, with a headline spec of IP65 ingress protection, and features a USB interface, operating voltage of 5V, and current draw of 200mA, and a compact, ruggedized design suitable for use in industrial control, medical devices, and outdoor applications, with a compact footprint of 17.1 x 5.4 x 1.2 inches Key specs: IP65, 104-Key, USB interface, 5V, 200mA.",https://www.arrow.com/en/products/keypads_and_keyboards_ckm104ip65_syn,103.75,/images/Keypads_and_Keyboards_CKM104IP65_SYN.jpg
Test and Measurement,Bench Power Supplies,Keysight U8038A-X3 30V 3A Compact USB-Programmable PSU,"The Keysight U8038A-X3 is a USB-programmable bench power supply delivering up to 30V and 3A of output power with a voltage tolerance of ±0.03% and current tolerance of ±0.02% allowing for precise control over output levels, featuring a frequency accuracy of 0.1Hz to 10kHz and operating temperature range of 0°C to 40°C, ideal for applications such as testing and debugging of DC-DC converters and portable electronics, housed in a compact 1/4 rack 2U high package Key specs: 30V, 3A, ±0.03% voltage tolerance, ±0.02% current tolerance, 0.1Hz to 10kHz, 1/4 rack 2U high package.",https://www.arrow.com/en/products/bench_power_supplies_u8038a_syn321,169.19,/images/Bench_Power_Supplies_U8038A_SYN321.jpg
Mobile Computing,Tablet PCs,"Getac ZX70 Fully Rugged Android Tablet with 1D Scanner, Wi-Fi and 4G","The Getac ZX70 is a fully rugged Android tablet designed for challenging environments, featuring a built-in 1D scanner, Wi-Fi and 4G connectivity, and a 7-inch 1280x800 display. It operates on 3.7V and consumes up to 2A, with an internal battery providing up to 10 hours of operation. Typical applications include warehouse management and logistics. The device measures 9.3 x 6.2 x 1.1 inches and weighs 2.2 pounds. Key specs: 7-inch display, 1280x800 resolution, Android 10, 1D scanner, Wi-Fi, 4G LTE.",https://www.arrow.com/en/products/tablet_pcs_rk8a_syn,2399.00,/images/Tablet_PCs_RK8A_SYN.jpg
Wire and Cable,Cable Assembly AC Power,"Volex Locking IEC C19 Power Cord 16 AWG, 14ft, 16A 250V","This Volex power cord is a locking IEC C19 cable assembly designed for secure connections in high-power applications. It features a 16 AWG wire gauge, 14ft length, and is rated for 16A 250V. The cord is built with a temperature range of -20°C to 70°C and is suitable for 50/60Hz operation. Typical applications include data center equipment, medical devices, and industrial control systems. The cord is packaged in a rugged, compact form factor. Key specs: 16 AWG, 14ft, 16A 250V, Locking IEC C19.",https://www.arrow.com/en/products/cable_assembly_ac_power_vlxc19_14_lck_syn,32.99,/images/Cable_Assembly_AC_Power_VLXC19_14_LCK_SYN.jpg
Power Supplies,DC to DC Converter and Switching Regulator Module,"Murata Power Solutions Isolated 12V to 5V, 100W Half Brick DC-DC Converter, 12V/6.25A, 100-240kHz SYN-MB12V5V","The 1847-DC12V5V-100W-SYN is an isolated 12V to 5V, 100W half brick DC-DC converter from Murata Power Solutions, featuring an input voltage range of 9-18V, output voltage of 5V with a tolerance of ±1%, and an output current of 6.25A. The converter operates at a frequency range of 100-240kHz and has a high efficiency of up to 90%. Typical applications include datacom and telecom equipment, as well as industrial control systems. The device is packaged in a standard half brick form-factor, measuring 2.4in x 1.45in x 0.52in. Key specs: 5V, 100W, 6.25A, ±1% tolerance, Half Brick.",https://www.arrow.com/en/products/dc_to_dc_converter_and_switching_regulator_module_1847_dc12v5v_100w_syn,278.52,/images/DC_to_DC_Converter_and_Switching_Regulator_Module_1847_DC12V5V_100W_SYN.jpg
